{
  "schemaVersion": "cirewind.public-lab-object-manifest/v1alpha1",
  "repository": "torjan0/cirewind-lab",
  "objectFormat": "sha1",
  "bundle": {
    "filename": "cirewind-lab.bundle",
    "format": "git-bundle-v2",
    "byteLength": 39656,
    "sha256": "16f41eac01532e764d2ed0518db2a7dafcbcd3bd6bcea5f8e4e9e23385667b99"
  },
  "identity": {
    "name": "torjan0",
    "email": "38338151+torjan0@users.noreply.github.com"
  },
  "commits": [
    {
      "role": "governance",
      "objectId": "574b978aa906a8651d4bc94165a80ad78bc2bb68",
      "treeObjectId": "c57d3ca14f5f2d9e95dc1ca322f2be13cfe0cc05",
      "parentObjects": [],
      "subject": "chore: establish public lab governance",
      "author": {
        "name": "torjan0",
        "email": "38338151+torjan0@users.noreply.github.com"
      },
      "authorTime": "2026-08-31T00:00:00Z",
      "committer": {
        "name": "torjan0",
        "email": "38338151+torjan0@users.noreply.github.com"
      },
      "committerTime": "2026-08-31T00:00:00Z"
    },
    {
      "role": "marker-a",
      "objectId": "afb628b57608bae0397cdb0d2201103c4e6a1f2e",
      "treeObjectId": "e7016f8d2cc87cf00cfdcfd759ce0ae1c51d17ab",
      "parentObjects": [
        "574b978aa906a8651d4bc94165a80ad78bc2bb68"
      ],
      "subject": "feat: add harmless marker A",
      "author": {
        "name": "torjan0",
        "email": "38338151+torjan0@users.noreply.github.com"
      },
      "authorTime": "2026-08-31T00:01:00Z",
      "committer": {
        "name": "torjan0",
        "email": "38338151+torjan0@users.noreply.github.com"
      },
      "committerTime": "2026-08-31T00:01:00Z"
    },
    {
      "role": "marker-b",
      "objectId": "941f217e2d8b8c9bce64cedfcc07a0dd749eb831",
      "treeObjectId": "ff7d02ee93a88478025f5f6c999285b61e1466af",
      "parentObjects": [
        "afb628b57608bae0397cdb0d2201103c4e6a1f2e"
      ],
      "subject": "test: add harmless affected marker B",
      "author": {
        "name": "torjan0",
        "email": "38338151+torjan0@users.noreply.github.com"
      },
      "authorTime": "2026-08-31T00:02:00Z",
      "committer": {
        "name": "torjan0",
        "email": "38338151+torjan0@users.noreply.github.com"
      },
      "committerTime": "2026-08-31T00:02:00Z"
    },
    {
      "role": "wrapper",
      "objectId": "71c0379d1ab6082c9bcd5e5a374704d537b0b520",
      "treeObjectId": "d11c133bb908e7ff548ef5a17803b8c725225f28",
      "parentObjects": [
        "941f217e2d8b8c9bce64cedfcc07a0dd749eb831"
      ],
      "subject": "feat: restore marker A and add stable wrapper",
      "author": {
        "name": "torjan0",
        "email": "38338151+torjan0@users.noreply.github.com"
      },
      "authorTime": "2026-08-31T00:03:00Z",
      "committer": {
        "name": "torjan0",
        "email": "38338151+torjan0@users.noreply.github.com"
      },
      "committerTime": "2026-08-31T00:03:00Z"
    },
    {
      "role": "reusable",
      "objectId": "f7442b6ef0fe635a6a5c319ad3f52d019b8c5027",
      "treeObjectId": "fb1d04995aaba568ea7ffe02f2af5fb5b2c0e91f",
      "parentObjects": [
        "71c0379d1ab6082c9bcd5e5a374704d537b0b520"
      ],
      "subject": "feat: add stable reusable workflow",
      "author": {
        "name": "torjan0",
        "email": "38338151+torjan0@users.noreply.github.com"
      },
      "authorTime": "2026-08-31T00:04:00Z",
      "committer": {
        "name": "torjan0",
        "email": "38338151+torjan0@users.noreply.github.com"
      },
      "committerTime": "2026-08-31T00:04:00Z"
    },
    {
      "role": "import",
      "objectId": "a9ca057fb991b5860c48c855d506e36eab07c221",
      "treeObjectId": "1623b36783329263d72070160b0772d2a586e255",
      "parentObjects": [
        "f7442b6ef0fe635a6a5c319ad3f52d019b8c5027"
      ],
      "subject": "feat: add public A-to-B-to-A scenarios",
      "author": {
        "name": "torjan0",
        "email": "38338151+torjan0@users.noreply.github.com"
      },
      "authorTime": "2026-08-31T00:05:00Z",
      "committer": {
        "name": "torjan0",
        "email": "38338151+torjan0@users.noreply.github.com"
      },
      "committerTime": "2026-08-31T00:05:00Z"
    }
  ],
  "tags": [
    {
      "name": "fixture-a",
      "kind": "annotated",
      "objectId": "88fc00c71d4e5875b7a4030e37be3d3a3d8f5c91",
      "peeledCommitId": "afb628b57608bae0397cdb0d2201103c4e6a1f2e",
      "tagger": {
        "name": "torjan0",
        "email": "38338151+torjan0@users.noreply.github.com"
      },
      "taggedAt": "2026-08-31T00:06:00Z"
    },
    {
      "name": "fixture-b",
      "kind": "annotated",
      "objectId": "9c0f7f1cfb03e156c0c8ebf4cab8356d4ebb01a9",
      "peeledCommitId": "941f217e2d8b8c9bce64cedfcc07a0dd749eb831",
      "tagger": {
        "name": "torjan0",
        "email": "38338151+torjan0@users.noreply.github.com"
      },
      "taggedAt": "2026-08-31T00:07:00Z"
    }
  ],
  "refs": [
    {
      "name": "HEAD",
      "objectId": "a9ca057fb991b5860c48c855d506e36eab07c221",
      "kind": "bundle-head",
      "peeledCommitId": "a9ca057fb991b5860c48c855d506e36eab07c221"
    },
    {
      "name": "refs/heads/main",
      "objectId": "a9ca057fb991b5860c48c855d506e36eab07c221",
      "kind": "branch",
      "peeledCommitId": "a9ca057fb991b5860c48c855d506e36eab07c221"
    },
    {
      "name": "refs/tags/fixture-a",
      "objectId": "88fc00c71d4e5875b7a4030e37be3d3a3d8f5c91",
      "kind": "annotated-tag",
      "peeledCommitId": "afb628b57608bae0397cdb0d2201103c4e6a1f2e"
    },
    {
      "name": "refs/tags/fixture-b",
      "objectId": "9c0f7f1cfb03e156c0c8ebf4cab8356d4ebb01a9",
      "kind": "annotated-tag",
      "peeledCommitId": "941f217e2d8b8c9bce64cedfcc07a0dd749eb831"
    },
    {
      "name": "refs/tags/v1",
      "objectId": "afb628b57608bae0397cdb0d2201103c4e6a1f2e",
      "kind": "lightweight-tag",
      "peeledCommitId": "afb628b57608bae0397cdb0d2201103c4e6a1f2e"
    }
  ],
  "objects": [
    {
      "objectId": "574b978aa906a8651d4bc94165a80ad78bc2bb68",
      "type": "commit",
      "byteLength": 309
    },
    {
      "objectId": "71c0379d1ab6082c9bcd5e5a374704d537b0b520",
      "type": "commit",
      "byteLength": 364
    },
    {
      "objectId": "941f217e2d8b8c9bce64cedfcc07a0dd749eb831",
      "type": "commit",
      "byteLength": 355
    },
    {
      "objectId": "a9ca057fb991b5860c48c855d506e36eab07c221",
      "type": "commit",
      "byteLength": 357
    },
    {
      "objectId": "afb628b57608bae0397cdb0d2201103c4e6a1f2e",
      "type": "commit",
      "byteLength": 346
    },
    {
      "objectId": "f7442b6ef0fe635a6a5c319ad3f52d019b8c5027",
      "type": "commit",
      "byteLength": 353
    },
    {
      "objectId": "140fc38c1c5a7d76d814673463078f056a902225",
      "type": "tree",
      "byteLength": 38
    },
    {
      "objectId": "1623b36783329263d72070160b0772d2a586e255",
      "type": "tree",
      "byteLength": 297
    },
    {
      "objectId": "1c77013d8ed8016d06c5872d698f493271176692",
      "type": "tree",
      "byteLength": 67
    },
    {
      "objectId": "26958aaa027e055842cfc557556d4f50fb56d044",
      "type": "tree",
      "byteLength": 280
    },
    {
      "objectId": "2cf832952ba578853976ed65c394aa9abd8f6a8b",
      "type": "tree",
      "byteLength": 44
    },
    {
      "objectId": "3eb046e166fd60ff183387bb7aaa19508e30fce2",
      "type": "tree",
      "byteLength": 40
    },
    {
      "objectId": "40b0e8b1183155ffb2a6638dad6159c7d194eeed",
      "type": "tree",
      "byteLength": 823
    },
    {
      "objectId": "491de4e1ee8b8bd3f2491d36a0b694cb8d8a027e",
      "type": "tree",
      "byteLength": 77
    },
    {
      "objectId": "60da8609c32bcf2590fde819065fe1d5e2b1f97c",
      "type": "tree",
      "byteLength": 33
    },
    {
      "objectId": "75c823c94519bf1bf727b94ca1d3d0e56f0820a6",
      "type": "tree",
      "byteLength": 38
    },
    {
      "objectId": "8e7299f6a72afcaf37f8d3aeb5733322ebd3dc4f",
      "type": "tree",
      "byteLength": 38
    },
    {
      "objectId": "a0e1739cea4b39175dacaf424e52bc361f7e964e",
      "type": "tree",
      "byteLength": 38
    },
    {
      "objectId": "c57d3ca14f5f2d9e95dc1ca322f2be13cfe0cc05",
      "type": "tree",
      "byteLength": 154
    },
    {
      "objectId": "d11c133bb908e7ff548ef5a17803b8c725225f28",
      "type": "tree",
      "byteLength": 188
    },
    {
      "objectId": "e38fcb51caa667be80e2bf22525942598d041378",
      "type": "tree",
      "byteLength": 36
    },
    {
      "objectId": "e7016f8d2cc87cf00cfdcfd759ce0ae1c51d17ab",
      "type": "tree",
      "byteLength": 188
    },
    {
      "objectId": "f60eacd359a6061ab6292bdb1cacc491b6aa25d5",
      "type": "tree",
      "byteLength": 33
    },
    {
      "objectId": "fb1d04995aaba568ea7ffe02f2af5fb5b2c0e91f",
      "type": "tree",
      "byteLength": 222
    },
    {
      "objectId": "ff7d02ee93a88478025f5f6c999285b61e1466af",
      "type": "tree",
      "byteLength": 188
    },
    {
      "objectId": "07612def39dcda375e8e3bc94d8ebed26ea7cb7a",
      "type": "blob",
      "byteLength": 1268
    },
    {
      "objectId": "0e92ec08acbd5b001ae7f38d8072d49278e6557e",
      "type": "blob",
      "byteLength": 300
    },
    {
      "objectId": "261eeb9e9f8b2b4b0d119366dda99c6fd7d35c64",
      "type": "blob",
      "byteLength": 11357
    },
    {
      "objectId": "28fc85d9e479c9a4eefc22e476570ada05a6d327",
      "type": "blob",
      "byteLength": 11230
    },
    {
      "objectId": "2945726191514d60205d16879933231107acf221",
      "type": "blob",
      "byteLength": 436
    },
    {
      "objectId": "2e3bedf207829519e53683eb3d82f5f1b0102477",
      "type": "blob",
      "byteLength": 1305
    },
    {
      "objectId": "37aad45f826ed3bdfb7d7b0305e9f93b3f6e1ebf",
      "type": "blob",
      "byteLength": 4190
    },
    {
      "objectId": "3d87e41041cb29e1e3d780fde28b81db2bdbf249",
      "type": "blob",
      "byteLength": 2998
    },
    {